{
  "comparison_version": "0",
  "comparison_id": "CMP-CONTRACT-FIXTURE-001",
  "evidence_class": "CONTRACT_FIXTURE",
  "source_binding": {
    "project_id": "fixture-project",
    "blueprint_revision_id": "fixture-rev-001",
    "blueprint_sha256": "aaaaaaaaaaaaaaaaaaaaaaaaaaaaaaaaaaaaaaaaaaaaaaaaaaaaaaaaaaaaaaaa",
    "music_ir_sha256": "bbbbbbbbbbbbbbbbbbbbbbbbbbbbbbbbbbbbbbbbbbbbbbbbbbbbbbbbbbbbbbbb",
    "target_duration_seconds": 20.0
  },
  "renderer_a": {
    "renderer_id": "fixture-renderer-a",
    "renderer_version": "0",
    "bound_music_ir_sha256": "bbbbbbbbbbbbbbbbbbbbbbbbbbbbbbbbbbbbbbbbbbbbbbbbbbbbbbbbbbbbbbbb",
    "runtime": {
      "kind": "in_process",
      "name": "fixture-runtime-a",
      "version": "0",
      "executable_sha256": null,
      "os": "fixture-os",
      "architecture": "fixture-arch"
    },
    "content": [],
    "config_sha256": "cccccccccccccccccccccccccccccccccccccccccccccccccccccccccccccccc",
    "raw_artifact": {
      "role": "wav",
      "sha256": "dddddddddddddddddddddddddddddddddddddddddddddddddddddddddddddddd",
      "size_bytes": 1,
      "sample_rate": 22050,
      "channels": 1,
      "bit_depth": 16,
      "duration_seconds": 20.0
    },
    "audio_quality_report": {
      "report_id": "fixture-qa-a",
      "report_sha256": "eeeeeeeeeeeeeeeeeeeeeeeeeeeeeeeeeeeeeeeeeeeeeeeeeeeeeeeeeeeeeeee",
      "status": "UNKNOWN"
    },
    "renderer_normalizations": []
  },
  "renderer_b": {
    "renderer_id": "fixture-renderer-b",
    "renderer_version": "0",
    "bound_music_ir_sha256": "bbbbbbbbbbbbbbbbbbbbbbbbbbbbbbbbbbbbbbbbbbbbbbbbbbbbbbbbbbbbbbbb",
    "runtime": {
      "kind": "external_process",
      "name": "fixture-runtime-b",
      "version": "0",
      "executable_sha256": "ffffffffffffffffffffffffffffffffffffffffffffffffffffffffffffffff",
      "os": "fixture-os",
      "architecture": "fixture-arch"
    },
    "content": [
      {
        "content_id": "fixture-content-b",
        "version": "0",
        "sha256": "1111111111111111111111111111111111111111111111111111111111111111"
      }
    ],
    "config_sha256": "2222222222222222222222222222222222222222222222222222222222222222",
    "raw_artifact": {
      "role": "wav",
      "sha256": "3333333333333333333333333333333333333333333333333333333333333333",
      "size_bytes": 1,
      "sample_rate": 48000,
      "channels": 2,
      "bit_depth": 16,
      "duration_seconds": 20.0
    },
    "audio_quality_report": {
      "report_id": "fixture-qa-b",
      "report_sha256": "4444444444444444444444444444444444444444444444444444444444444444",
      "status": "UNKNOWN"
    },
    "renderer_normalizations": []
  },
  "technical_validity": {
    "source_hash_match": true,
    "blueprint_binding_match": true,
    "qa_acceptable": false,
    "target_duration_match": true,
    "provenance_complete": false
  },
  "analysis_policy": {
    "policy_id": "musica-objective-audio-comparison-v0",
    "policy_version": "0",
    "sample_domain": "full_scale_normalized_native_pcm",
    "time_domain_channel_policy": "all_channel_sample_energy",
    "spectral_channel_policy": "arithmetic_channel_mean",
    "spectral_window_ms": 50.0,
    "spectral_overlap_ratio": 0.5,
    "spectral_window_function": "hann",
    "frequency_floor_hz": 20.0,
    "frequency_ceiling_hz": 9922.5,
    "silence_threshold_dbfs": -80.0,
    "comparison_resampling": "NONE",
    "comparison_gain_matching": "NONE",
    "comparison_time_stretching": "NONE"
  },
  "objective_metrics_a": {
    "rms_dbfs": {"status": "UNKNOWN", "value": null, "unit": "dBFS", "method": "m5-r4-v0"},
    "peak_dbfs": {"status": "UNKNOWN", "value": null, "unit": "dBFS", "method": "m5-r4-v0"},
    "crest_factor_db": {"status": "UNKNOWN", "value": null, "unit": "dB", "method": "m5-r4-v0"},
    "silence_ratio": {"status": "UNKNOWN", "value": null, "unit": "ratio", "method": "m5-r4-v0"},
    "dc_offset_normalized": {"status": "UNKNOWN", "value": null, "unit": "normalized", "method": "m5-r4-v0"},
    "stereo_correlation": {"status": "NOT_APPLICABLE", "value": null, "unit": "correlation", "method": "m5-r4-v0"},
    "stereo_difference_rms_dbfs": {"status": "NOT_APPLICABLE", "value": null, "unit": "dBFS", "method": "m5-r4-v0"},
    "spectral_centroid_hz": {"status": "UNKNOWN", "value": null, "unit": "Hz", "method": "m5-r4-v0"},
    "spectral_rolloff_95_hz": {"status": "UNKNOWN", "value": null, "unit": "Hz", "method": "m5-r4-v0"},
    "band_energy_low_ratio": {"status": "UNKNOWN", "value": null, "unit": "ratio", "method": "m5-r4-v0"},
    "band_energy_mid_ratio": {"status": "UNKNOWN", "value": null, "unit": "ratio", "method": "m5-r4-v0"},
    "band_energy_high_ratio": {"status": "UNKNOWN", "value": null, "unit": "ratio", "method": "m5-r4-v0"}
  },
  "objective_metrics_b": {
    "rms_dbfs": {"status": "UNKNOWN", "value": null, "unit": "dBFS", "method": "m5-r4-v0"},
    "peak_dbfs": {"status": "UNKNOWN", "value": null, "unit": "dBFS", "method": "m5-r4-v0"},
    "crest_factor_db": {"status": "UNKNOWN", "value": null, "unit": "dB", "method": "m5-r4-v0"},
    "silence_ratio": {"status": "UNKNOWN", "value": null, "unit": "ratio", "method": "m5-r4-v0"},
    "dc_offset_normalized": {"status": "UNKNOWN", "value": null, "unit": "normalized", "method": "m5-r4-v0"},
    "stereo_correlation": {"status": "UNKNOWN", "value": null, "unit": "correlation", "method": "m5-r4-v0"},
    "stereo_difference_rms_dbfs": {"status": "UNKNOWN", "value": null, "unit": "dBFS", "method": "m5-r4-v0"},
    "spectral_centroid_hz": {"status": "UNKNOWN", "value": null, "unit": "Hz", "method": "m5-r4-v0"},
    "spectral_rolloff_95_hz": {"status": "UNKNOWN", "value": null, "unit": "Hz", "method": "m5-r4-v0"},
    "band_energy_low_ratio": {"status": "UNKNOWN", "value": null, "unit": "ratio", "method": "m5-r4-v0"},
    "band_energy_mid_ratio": {"status": "UNKNOWN", "value": null, "unit": "ratio", "method": "m5-r4-v0"},
    "band_energy_high_ratio": {"status": "UNKNOWN", "value": null, "unit": "ratio", "method": "m5-r4-v0"}
  },
  "paired_deltas": [],
  "comparison_normalizations": [],
  "confounds": [
    {
      "code": "MISSING_PROVENANCE",
      "status": "RECORDED",
      "description": "Contract fixture only; no execution evidence exists."
    }
  ],
  "comparability": {
    "status": "NOT_COMPARABLE",
    "reasons": ["CONTRACT_FIXTURE_ONLY"]
  },
  "claim_boundary": {
    "human_subject_evidence": "NOT_VALIDATED",
    "perceptual_superiority": "UNKNOWN",
    "human_preference_claim_allowed": false
  },
  "verdict": "NOT_COMPARABLE"
}
